{
  "apiVersion": "qos-binding-placement/v1",
  "kind": "Placement",
  "metadata": {
    "name": "small_placement_cloud_only_placement"
  },
  "spec": {
    "pools": {
      "p_fog": {
        "capacity": {
          "memory": 4.0
        },
        "kind": "FOG"
      },
      "p_cloud": {
        "capacity": {
          "memory": 100.0
        },
        "kind": "CLOUD_FAAS"
      },
      "external_user_device": {
        "kind": "EXTERNAL",
        "capacity": {
          "memory": 0.0
        }
      }
    },
    "demands": [
      {
        "candidate": {
          "resource": "catalog",
          "id": "c_cloud"
        },
        "pool": {
          "resource": "placement",
          "id": "p_cloud"
        },
        "resources": {
          "memory": 2.0
        }
      },
      {
        "candidate": {
          "resource": "catalog",
          "id": "c_fog"
        },
        "pool": {
          "resource": "placement",
          "id": "p_fog"
        },
        "resources": {
          "memory": 2.0
        }
      }
    ],
    "networkMode": "symmetric",
    "network": [
      {
        "from": {
          "resource": "placement",
          "id": "p_cloud"
        },
        "to": {
          "resource": "placement",
          "id": "p_cloud"
        },
        "latency": 0.0
      },
      {
        "from": {
          "resource": "placement",
          "id": "p_fog"
        },
        "to": {
          "resource": "placement",
          "id": "p_cloud"
        },
        "latency": 4.0
      },
      {
        "from": {
          "resource": "placement",
          "id": "p_fog"
        },
        "to": {
          "resource": "placement",
          "id": "p_fog"
        },
        "latency": 0.0
      }
    ],
    "events": {
      "user_device": {
        "pool": {
          "resource": "placement",
          "id": "external_user_device"
        },
        "latency": [
          {
            "pool": {
              "resource": "placement",
              "id": "p_cloud"
            },
            "latency": 9.0
          },
          {
            "pool": {
              "resource": "placement",
              "id": "p_fog"
            },
            "latency": 5.0
          }
        ]
      }
    },
    "transitions": {
      "tr_login_process": {
        "from": {
          "resource": "application",
          "id": "t_login"
        },
        "to": {
          "resource": "application",
          "id": "t_process"
        },
        "maximum": 15.0,
        "enforcement": "hard",
        "feature": {
          "resource": "application",
          "id": "latency"
        }
      },
      "tr_event_login": {
        "from": {
          "resource": "placement",
          "id": "user_device"
        },
        "to": {
          "resource": "application",
          "id": "t_login"
        },
        "maximum": 6.0,
        "enforcement": "hard",
        "feature": {
          "resource": "application",
          "id": "latency"
        }
      }
    },
    "capacityRules": [
      {
        "resources": [
          "memory"
        ],
        "scope": "selectedCandidate"
      }
    ],
    "globalLatency": {
      "feature": {
        "resource": "application",
        "id": "latency"
      },
      "includeExecution": true,
      "exclusive": "routing",
      "parallel": "max"
    }
  }
}
